{
  "zpds_version": "0.1.0",
  "dataset_id": "zpds_wp0_demo",
  "dataset_version": "0.1.0",
  "name": "ZPDS WP0 最小数据集",
  "description": "只用于验证治理 Schema，不对应真实交付数据。",
  "created_at": "2026-07-23T00:00:00Z",
  "source_types": [
    "guida_ego",
    "dunjia_ego",
    "jianzhi_umi",
    "a2d_robot",
    "epic100"
  ],
  "default_prep_revision": "r0001",
  "default_experience_version": "v0.1.0"
}
